{
  "schemaVersion": "1.1.0",
  "curationLevel": "full",
  "indexable": true,
  "pageId": "acne-demo",
  "pageType": "condition",
  "title": "Acne information",
  "summary": "A synthetic demonstration record covering adult acne, breakouts, and the role of an acne evaluation.",
  "seoDescription": "A synthetic demonstration record covering adult acne, breakouts, and the role of an acne evaluation.",
  "aliases": [
    "acne",
    "adult acne",
    "breakouts",
    "in my 30s still get breakouts",
    "breakout treatment options"
  ],
  "source": {
    "url": "https://revelusdermatology.com/conditions/acne/",
    "wordpressId": 9002,
    "wordpressType": "condition",
    "modifiedGmt": "2026-09-03T00:00:00.000Z",
    "capturedAt": "2026-09-03T00:00:00.000Z",
    "htmlSha256": "98836376654d0fb9a6e22b9e7773353a5b1cc3c581ce24b492be40b9aeac963e",
    "restSha256": "98836376654d0fb9a6e22b9e7773353a5b1cc3c581ce24b492be40b9aeac963e",
    "volatility": "stable"
  },
  "contentOutline": [
    {
      "level": 1,
      "heading": "Acne information"
    }
  ],
  "atAGlance": [],
  "atAGlanceFootnotes": [],
  "atAGlanceProvenance": [],
  "facts": [],
  "faqs": [
    {
      "faqId": "faq:demo:acne-demo:001",
      "question": "I'm in my 30s and still get breakouts. What are my options?",
      "answer": "Yes. Adults with persistent breakouts can schedule an acne evaluation to discuss appropriate options.",
      "answerMode": "canonical_quote",
      "supportingFactIds": [],
      "relatedActionIds": [],
      "provenance": [
        {
          "sourceUrl": "https://revelusdermatology.com/conditions/acne/",
          "sourceKind": "synthetic_demo",
          "sourceExcerpt": "Yes. Adults with persistent breakouts can schedule an acne evaluation to discuss appropriate options.",
          "capturedAt": "2026-09-03T00:00:00.000Z",
          "section": "Synthetic demonstration"
        }
      ]
    }
  ],
  "relationships": [],
  "actions": [],
  "media": [],
  "conflicts": [],
  "answerSafety": {
    "informationalOnly": true,
    "mayDiagnose": false,
    "mayPersonalizeTreatment": false,
    "escalateWhen": [
      "The request contains patient information or asks for personal medical advice."
    ]
  },
  "review": {
    "status": "synthetic_demo",
    "reviewedAt": "2026-09-03T00:00:00.000Z",
    "reviewNotes": [
      "Manually authored for the ten-query public demonstration."
    ]
  }
}
