{
  "schemaVersion": "1.1.0",
  "curationLevel": "full",
  "indexable": true,
  "pageId": "eczema-demo",
  "pageType": "condition",
  "title": "Eczema information",
  "summary": "A synthetic demonstration record explaining that recurring itchy patches can be discussed with a dermatology professional.",
  "seoDescription": "A synthetic demonstration record explaining that recurring itchy patches can be discussed with a dermatology professional.",
  "aliases": [
    "eczema",
    "itchy patch on my elbow",
    "recurring itchy patch"
  ],
  "source": {
    "url": "https://revelusdermatology.com/conditions/eczema/",
    "wordpressId": 9001,
    "wordpressType": "condition",
    "modifiedGmt": "2026-09-03T00:00:00.000Z",
    "capturedAt": "2026-09-03T00:00:00.000Z",
    "htmlSha256": "74edb44b2bf65296f6b1963e4d4a677b8f1b1421b8d61a3a8a5e04c271947af4",
    "restSha256": "74edb44b2bf65296f6b1963e4d4a677b8f1b1421b8d61a3a8a5e04c271947af4",
    "volatility": "stable"
  },
  "contentOutline": [
    {
      "level": 1,
      "heading": "Eczema information"
    }
  ],
  "atAGlance": [],
  "atAGlanceFootnotes": [],
  "atAGlanceProvenance": [],
  "facts": [],
  "faqs": [
    {
      "faqId": "faq:demo:eczema-demo:001",
      "question": "Can a dermatologist evaluate a recurring itchy patch?",
      "answer": "Yes. A dermatology visit can evaluate a recurring itchy patch. This demonstration does not diagnose the cause.",
      "answerMode": "canonical_quote",
      "supportingFactIds": [],
      "relatedActionIds": [],
      "provenance": [
        {
          "sourceUrl": "https://revelusdermatology.com/conditions/eczema/",
          "sourceKind": "synthetic_demo",
          "sourceExcerpt": "Yes. A dermatology visit can evaluate a recurring itchy patch. This demonstration does not diagnose the cause.",
          "capturedAt": "2026-09-03T00:00:00.000Z",
          "section": "Synthetic demonstration"
        }
      ]
    }
  ],
  "relationships": [],
  "actions": [],
  "media": [],
  "conflicts": [],
  "answerSafety": {
    "informationalOnly": true,
    "mayDiagnose": false,
    "mayPersonalizeTreatment": false,
    "escalateWhen": [
      "The request contains patient information or asks for personal medical advice."
    ]
  },
  "review": {
    "status": "synthetic_demo",
    "reviewedAt": "2026-09-03T00:00:00.000Z",
    "reviewNotes": [
      "Manually authored for the ten-query public demonstration."
    ]
  }
}
